<?xml version="1.0" encoding="UTF-8"?>
<!ELEMENT musiccollect (music+)>
<!ELEMENT music (musictopic,musicdesc,musicpara)>
<!ELEMENT musictopic (#PCDATA)>
<!ELEMENT musicdesc (#PCDATA)>
<!ELEMENT musicpara (#PCDATA)>
<!ATTLIST music musicId CDATA #REQUIRED>